{
  "title": "Top shelf",
  "description": "This pelike depicts the use of a mobility aid: a staff or cane. In ancient Greece, staff-like objects were also symbols of power, authority and justice. Archaeological narratives are selective about how these artefacts are interpreted, often rejecting the possibility of disability coinciding with symbols of power.",
  "image": {
    "url": "assets/placeholders/PLACEHOLDER-empty-glass-display-case-modern.jpg",
    "altText": "Object 1. A Pelike. A large Greek-style vase. The scene depicts two men facing each other. One appears to use a staff, possibly as a mobility aid.",
    "caption": "Pelike, MU4759, front view © Gale History Museum"
  },
  "artifacts": [
    {
      "description": "TBC",
      "metaDescription": {
        "name": "Pelike",
        "accNo": "MU4759",
        "material": "Ceramic",
        "dimension": [
          0,
          0,
          0
        ],
        "details": "Painter of Bari 8010, Southern Italy, 350-340 B.C.E. Purchase, 2013"
      },
      "images": [
        {
          "url": "assets/exhibitionShelfs/Top Shelf/Pelike/1 Pelike_MU4759_front_Image1.jpg",
          "altText": "Object 1. A Pelike. A large Greek-style vase. The scene depicts two men facing each other. One appears to use a staff, possibly as a mobility aid.",
          "caption": "Pelike, MU4759, front view © Gale History Museum"
        },
        {
          "url": "assets/exhibitionShelfs/Top Shelf/Pelike/1 Pelike_MU4759_front scene_Image2.jpg",
          "altText": "Object 1. Close-up of the scene on a pelike. A large Greek-style vase. The scene depicts two men facing each other. One appears to use a staff, possibly as a mobility aid.",
          "caption": "Pelike, MU4759, front close-up of scene © Gale History Museum"
        },
        {
          "url": "assets/exhibitionShelfs/Top Shelf/Pelike/1 Pelike_MU4759_back_Image3.jpg",
          "altText": "Object 1. A Pelike. A large Greek-style vase. The scene depicts one seated man and one standing woman facing each other. The woman holds a fan and the man a dish of some sort. Flower-like shapes border the top, scrolls and swirls line the sides, and a Greek key runs along the bottom.",
          "caption": "Pelike, MU4759, back view © Gale History Museum"
        }
      ],
      "audioDescription": {
        "url": "TBC",
        "transcript": "This large ceramic vessel has a wide, thick rim upon a flared neck. A line of leaf-like decorations wraps around the neck. It has one handle on either side, starting below the rim and meeting at the shoulder of the vessel, which becomes a wide, bulbous body upon a circular base. The vessel is black in colour with a light orange scene in the centre. The scene depicts two young men facing each other. Both men are barefoot, have curly hair and wear large toga-style tunics that cover their bodies to the ankle, draping across one shoulder and leaving the other exposed. The man on the left is holding a long staff with his right hand; his arm is bent at the elbow. His right leg is outlined by the fabric and appears to be slightly bent forward, while his right shoulder is facing downwards, as if he is being supported by this staff. The other figure holds a shorter, curved object with his right hand around shoulder height; his arm is bent at the elbow. The two figures are standing on a geometric pattern above the vessel base and are framed by swirling patterns on either side."
      }
    }
  ]
}
